{
  "arc_id": "arc_crisis_recovery",
  "arc_name": "Crisis Recovery",
  "version": "1.0",
  "description": "A $4.8M ARR data center account suffers a catastrophic cooling failure that takes 40% of GPU fleet offline. Health plummets from 82 to 31. The CS team mobilizes a war room, orchestrates systematic recovery, and secures renewal plus $1.2M expansion -- proving 2,495% ROI on $185K CS investment.",
  "intelligence_dimensions": [
    "operational_risk",
    "relationship_resilience",
    "value_realization",
    "sentiment_momentum"
  ],
  "target_audience": "CFO",
  "revenue_narrative": {
    "arr_start": 4800000,
    "arr_end": 6000000,
    "arr_at_risk_peak": 4800000,
    "roi_of_intervention": 2495,
    "cost_of_inaction": 4800000,
    "time_horizon_weeks": 32,
    "intervention_cost": 185000,
    "net_revenue_saved": 4615000
  },
  "cast": [
    {
      "role": "decision_maker",
      "title": "VP Operations",
      "influence_score": 0.92,
      "sentiment_arc": [
        0.6,
        -0.8,
        -0.3,
        0.4,
        0.8
      ],
      "engagement_frequency": "weekly",
      "appears_in_phase": [
        1,
        2,
        3,
        4,
        5
      ]
    },
    {
      "role": "exec_sponsor",
      "title": "CTO",
      "influence_score": 0.95,
      "sentiment_arc": [
        0.5,
        -0.9,
        -0.5,
        0.2,
        0.7
      ],
      "engagement_frequency": "biweekly",
      "appears_in_phase": [
        1,
        2,
        3,
        4,
        5
      ]
    },
    {
      "role": "technical_lead",
      "title": "Data Center Manager",
      "influence_score": 0.78,
      "sentiment_arc": [
        0.7,
        -0.6,
        -0.1,
        0.5,
        0.8
      ],
      "engagement_frequency": "weekly",
      "appears_in_phase": [
        1,
        2,
        3,
        4,
        5
      ]
    },
    {
      "role": "champion",
      "title": "Customer Success Manager",
      "influence_score": 0.85,
      "sentiment_arc": [
        0.7,
        -0.4,
        0.2,
        0.6,
        0.9
      ],
      "engagement_frequency": "weekly",
      "appears_in_phase": [
        1,
        2,
        3,
        4,
        5
      ]
    },
    {
      "role": "technical_lead",
      "title": "Support Engineering Lead",
      "influence_score": 0.8,
      "sentiment_arc": [
        0.5,
        -0.3,
        0.3,
        0.6,
        0.7
      ],
      "engagement_frequency": "weekly",
      "appears_in_phase": [
        2,
        3,
        4,
        5
      ]
    }
  ],
  "phases": [
    {
      "phase_id": 1,
      "name": "Pre-Crisis Baseline",
      "duration_weeks": 6,
      "health_range": {
        "start": 82,
        "end": 80
      },
      "description": "Account is healthy and performing well. Routine operations with stable KPIs. Subtle early-warning signals appear in thermal management trending slightly downward and preventive maintenance slipping, but overall health remains solidly in the healthy zone.",
      "revenue_impact_type": "none",
      "plot_points": [
        {
          "week_offset": 1,
          "event_type": "milestone",
          "description": "Quarterly Business Review confirms strong GPU utilization at 78% and healthy expansion trajectory. VP Operations expresses satisfaction with platform stability.",
          "sentiment_shift": 0.1,
          "kpi_impacts": [
            {
              "kpi_code": "P3-KPI1",
              "direction": "plateau",
              "magnitude": "minor"
            },
            {
              "kpi_code": "P5-KPI1",
              "direction": "plateau",
              "magnitude": "minor"
            }
          ],
          "revenue_impact": 0,
          "generates_node_type": "SIGNAL"
        },
        {
          "week_offset": 3,
          "event_type": "signal",
          "description": "Thermal Management Score dips from 97% to 93%, crossing below target threshold. CRAC unit in Zone B showing intermittent temperature spikes during peak GPU load.",
          "sentiment_shift": 0,
          "kpi_impacts": [
            {
              "kpi_code": "P2-KPI5",
              "direction": "degrade",
              "magnitude": "minor"
            },
            {
              "kpi_code": "P2-KPI6",
              "direction": "degrade",
              "magnitude": "minor"
            }
          ],
          "revenue_impact": 0,
          "generates_node_type": "SIGNAL"
        },
        {
          "week_offset": 5,
          "event_type": "signal",
          "description": "Preventive Maintenance Compliance drops to 88% as ops team defers CRAC unit inspection to prioritize a new deployment. CSM notes this in weekly sync but no action taken.",
          "sentiment_shift": -0.05,
          "kpi_impacts": [
            {
              "kpi_code": "P2-KPI8",
              "direction": "degrade",
              "magnitude": "moderate"
            },
            {
              "kpi_code": "P2-KPI5",
              "direction": "degrade",
              "magnitude": "minor"
            }
          ],
          "revenue_impact": 0,
          "generates_node_type": "SIGNAL",
          "csm_action": {
            "action_type": "flag_risk",
            "description": "CSM flags deferred maintenance in weekly report, recommends scheduling CRAC inspection",
            "cost_estimate": 500,
            "response_time_hours": 48
          }
        }
      ]
    },
    {
      "phase_id": 2,
      "name": "Crisis Event",
      "duration_weeks": 2,
      "health_range": {
        "start": 78,
        "end": 31
      },
      "description": "Catastrophic cooling system failure cascades through the data center. CRAC Unit B fails completely, causing thermal breach in 3 GPU rows. Emergency thermal shutdown takes 40% of GPU fleet offline. Training jobs abort mid-epoch, RMA requests flood in, and critical incident count spikes. Health score plummets from 78 to 31 in 10 days.",
      "revenue_impact_type": "at_risk",
      "plot_points": [
        {
          "week_offset": 1,
          "event_type": "incident",
          "description": "CRAC Unit B compressor fails at 02:14 AM. Zone B ambient temperature rises from 22C to 38C in 47 minutes. Thermal protection triggers emergency GPU throttling on 3 rows (128 GPUs).",
          "sentiment_shift": -0.6,
          "kpi_impacts": [
            {
              "kpi_code": "P2-KPI5",
              "direction": "degrade",
              "magnitude": "critical"
            },
            {
              "kpi_code": "P2-KPI4",
              "direction": "degrade",
              "magnitude": "critical"
            },
            {
              "kpi_code": "P3-KPI1",
              "direction": "degrade",
              "magnitude": "critical"
            },
            {
              "kpi_code": "P2-KPI6",
              "direction": "spike",
              "magnitude": "major"
            }
          ],
          "revenue_impact": -4800000,
          "generates_node_type": "SIGNAL"
        },
        {
          "week_offset": 1,
          "event_type": "escalation",
          "description": "8 active training jobs abort mid-epoch. Training Job Completion Rate crashes to 35%. Data Center Manager triggers P1 incident protocol and pages VP Operations. CTO notified within the hour.",
          "sentiment_shift": -0.3,
          "kpi_impacts": [
            {
              "kpi_code": "P3-KPI2",
              "direction": "degrade",
              "magnitude": "critical"
            },
            {
              "kpi_code": "P3-KPI4",
              "direction": "spike",
              "magnitude": "major"
            },
            {
              "kpi_code": "P2-KPI3",
              "direction": "spike",
              "magnitude": "critical"
            },
            {
              "kpi_code": "P3-KPI8",
              "direction": "degrade",
              "magnitude": "critical"
            }
          ],
          "revenue_impact": 0,
          "generates_node_type": "SIGNAL",
          "csm_action": {
            "action_type": "emergency_response",
            "description": "CSM activates crisis protocol, schedules emergency bridge call with VP Operations and CTO within 2 hours",
            "cost_estimate": 2000,
            "response_time_hours": 2
          }
        },
        {
          "week_offset": 1,
          "event_type": "incident",
          "description": "Post-thermal-breach inspection reveals 14 GPUs with thermal damage requiring RMA. RMA Frequency Rate spikes to 4.4%. MTBF drops to 2,100 hours. Full $4.8M ARR now at risk as customer's CTO questions platform reliability.",
          "sentiment_shift": -0.4,
          "kpi_impacts": [
            {
              "kpi_code": "P2-KPI1",
              "direction": "spike",
              "magnitude": "critical"
            },
            {
              "kpi_code": "P2-KPI2",
              "direction": "degrade",
              "magnitude": "critical"
            },
            {
              "kpi_code": "P5-KPI1",
              "direction": "degrade",
              "magnitude": "major"
            },
            {
              "kpi_code": "P5-KPI7",
              "direction": "degrade",
              "magnitude": "critical"
            }
          ],
          "revenue_impact": 0,
          "generates_node_type": "SIGNAL"
        },
        {
          "week_offset": 2,
          "event_type": "decision",
          "description": "VP Operations convenes emergency leadership meeting. GPU utilization at 38%, inference latency P95 ballooned to 320ms, distributed training efficiency collapsed. Customer threatens to evaluate competing platforms if recovery timeline exceeds 30 days.",
          "sentiment_shift": -0.2,
          "kpi_impacts": [
            {
              "kpi_code": "P3-KPI3",
              "direction": "spike",
              "magnitude": "critical"
            },
            {